YEAR,ID,TYPE,ARCHITECTURE,TECHNOLOGY,TITLE,ABSTRACT,AUTHORS,COMMENTS,Csamp [pF],AREA [mm^2],SNDR_lf [dB],fin_hf [Hz],SNDR_hf [dB],SNR [dB],DR [dB],-THD [dB],SFDR [dB],SNDR_plot [dB],P [W],fs [Hz],OSR,fsnyq [Hz],P/fsnyq [pJ],FOMW_lf [fJ/conv-step],FOMW_hf [fJ/conv-step],FOMS_lf [dB],FOMS_hf [dB],FOMW_hf/fsnyq,"FOMS,hf+10log(fsnyq)",source
2015,26.7,NQ,"SAR, TI",0.045,A 2.6b/cycle-architecture-based 10b 1.7GS/s 15.4mW 4x Time-interleaved SAR ADC with a Multi-step Hardware Retirement Technique,"A multi-step hardware retirement technique with redundancies that turns off low-accuracy designed hardware blocks respective to the decision state is proposed to improve power efficiency in multi-bit/cycle architectures, which has been employed to increase the conversion rate of a single channel in alleviating timing skew calibration burdens. The 4x TI 10b prototype design achieves an SNDR of 51.24dB at the Nyquist input, resulting in a FOM of 30.4fJ/conv.-step at 1.7 GS/s conversion rate and 1.2V supply.","H-K. Hong, H-W. Kang, D-S. Jo, D-S. Lee, Y-S. You,Y-H. Lee, H-J. Park, S-T. Ryu", ,0.4,0.057,55.3,880000000,51.2,,,,62,51.2,1.54E-02,1.70E+09,1,1.70E+09,9.06E+00,19,30.5,162.7,158.6,1.80E-08,250.92,ISSCC
2016,3.2,NQ,"SAR, TI",0.028,A 320mW 32Gb/s 8b ADC-Based PAM-4 Analog Front-End with Programmable Gain Control and Analog Peaking in 28nm CMOS,"In Paper 3.2, Broadcom presents a 32Gb/s 8b ADC-based PAM-4 receiver in 28nm CMOS. The ADC achieves an ENOB of 6.4 and 5.85 at DC and Nyquist, respectively. The entire receiver, occupying 0.89mm2, features a continuous-time linear equalizer with a 7dB peaking gain, and compensates for channel loss of more than 50dB at 16GHz while consuming 320mW.","Delong Cui, Heng Zhang, Nick Huang, Ali Nazemi, Burak Catli, Hyo Gyuem Rhew, Bo Zhang, Afshin Momtaz, Jun Cao","Power includes CTLE, PGA",,0.5933,43.9,8000000000,37,,,,,37,3.20E-01,1.60E+10,1,1.60E+10,2.00E+01,156.3,346.7,147.9,141,2.17E-08,243,ISSCC
2016,15.1,OS,SDCT,0.065,A 24.7mW 45MHz-BW 75.3dB-SNDR SAR-Assisted CT ?д Modulator with 2nd-Order Noise Coupling in 65nm CMOS,"In Paper 15.1, the University of Texas at Dallas introduces a SAR-assisted continuous-time delta-sigma modulator in 65nm CMOS that uses 2nd-order noise coupling to achieve a peak SNDR of 75.3dB SNDR in 45MHz BW.","Bo Wu, Shuang Zhu, Benwei Xu, Yun Chiu", ,,0.16,,5000000,75.3,78.5,82.5,,,75.3,2.47E-02,9.00E+08,10,9.00E+07,2.74E+02,,57.7,,167.9,6.41E-07,247.45,ISSCC
2016,15.2,OS,SDCT,0.065,2.2GHz Continuous-Time ?д ADC with -102dBc THD and 25MHz BW,"In Paper 15.2, NXP Semiconductors and Catena Microelectronics present a converter that uses a 1b feedback DAC with a return-to-open technique to achieve a high linearity of -102dBc/-104dBc THD/IM3 in a 25MHz bandwidth.","Lucien Breems, Muhammed Bolatkale, Hans Brekelmans, Shagun Bajoria, Jan Niehof, Robert Rutten, Bert Oude-Essink, Franco Fritschij, Jagdip Singh, Gerard Lassche", ,,0.25,,2500000,77,,77,102,110,77,4.14E-02,2.20E+09,44,5.00E+07,8.28E+02,,143.1,,164.8,2.86E-06,241.8,ISSCC
2016,15.3,OS,SDCT,0.065,A 1V 77dB-DR 72dB-SNDR 10MHz-BW 2-1 MASH CT ?дM,"In Paper 15.3, New University of Lisbon presents a 65nm CMOS 10MHz BW passive-active CT 2-1 MASH ?дM that uses RC integrators and low gain stages to achieve high power efficiency.","Blazej Nowacki, Nuno Paulino, Joao Goes", ,,0.027,,1000000,72.2,76,77,,,72.2,1.57E-03,1.00E+09,50,2.00E+07,7.85E+01,,23.6,,170.2,1.18E-06,243.25,ISSCC
2016,15.4,OS,SDCT,0.18,A 280?W 24kHz-BW 98.5dB-SNDR Chopped Single-Bit CT ?дM Achieving <10Hz 1/f Noise Corner Without Chopping Artifacts,"In Paper 15.4, IIT Madras introduces a 1b modulator with chopping used in conjunction with a FIR feedback DAC to achieve a 1/f corner frequency of <10Hz without chopping artifacts and 98.5dB SNDR in the audio band.","Sujith Billa, Amrith Sukumaran, Shanthi Pavan", ,,1.3335,,6000,98.5,99.3,103.6,,107.6,98.5,2.80E-04,6.14E+06,128,4.80E+04,5.83E+03,,84.8,,177.8,1.77E-03,224.64,ISSCC
2016,15.5,OS,SDCT,0.028,A 930mW 69dB-DR 465MHz-BW CT 1-2 MASH ADC in 28nm CMOS,In Paper 15.5 Analog Devices describes a continuous-time 1-2 MASH ADC clocking at 8GHz in 28nm CMOS. This ADC achieves the largest signal bandwidth (465MHz) thus far reported for a CMOS delta-sigma ADC.,"Yunzhi Dong, Jialin Zhao, Wenhua Yang, Trevor Caldwell, Hajime Shibata, Richard Schreier, Qingdong Meng, Jose Silva, Donald Paterson, Jeffrey Gealow",Data for fs=6 GHz,,1.4,,70000000,64.8,66.8,73,,,64.8,7.56E-01,6.00E+09,8.6,7.00E+08,1.08E+03,,760.5,,151.5,1.09E-06,239.91,ISSCC
2016,15.6,OS,SDCT,0.016,A 160MHz-BW 72dB-DR 40mW Continuous-Time ?д Modulator in 16nm CMOS with Analog ISIReduction Technique,In Paper number 15.6 MediaTek describes a 4th-order continuous-time delta-sigma ADC in 16nm CMOS. The ADC uses an analog ISI-reduction technique to achieve 72dB DR over 160MHz with only 40mW of power.,"Su-Hao Wu, Tsung-Kai Kao, Zwei-Mei Lee, Ping Chen, Jui-Yuan Tsai", ,,0.155,,30000000,65.3,68.1,72.1,71,,65.3,4.00E-02,2.88E+09,9,3.20E+08,1.25E+02,,82.8,,161.4,2.59E-07,246.4,ISSCC
2016,15.7,OS,SDSC,0.16,A 1.65mW 0.16mm2 Dynamic Zoom-ADC with 107.5dB DR in 20kHz BW,In Paper 15.7 Delft University of Technology and NXP Semiconductors describe a Dynamic Zoom ADC that uses energy-efficient pseudo-differential inverter-based OTAs to achieve 107.5dB of dynamic range over the audio band with only 1.6mW of power.,"Burak G”nen, Fabio Sebastiano, Robert van Veldhoven, Kofi A. A. Makinwa", ,,0.16,,1000,98.3,104.4,107.5,,,98.3,1.65E-03,1.13E+07,282,4.00E+04,4.13E+04,,613.7,,169.1,1.53E-02,215.16,ISSCC
2016,15.8,OS,SDSC,0.35,A 22.3b 1kHz 12.7mW Switched-Capacitor ?д Modulator with Stacked Split-Steering Amplifiers,"In paper 15.8, ams describes a 1b discrete-time modulator that uses amplifier stacking to achieve 136dB of dynamic range in a bandwidth of 1kHz with only 13mW of power consumption.","Matthias Steiner, Nigel Greer", ,,11.48,,110,,,136.3,116,,116,1.27E-02,6.40E+05,320,2.00E+03,6.35E+06,,12308.5,,165,6.15E+00,197.97,ISSCC
2016,27.2,OS,SAR,0.055,An Oversampling SAR ADC with DAC Mismatch Error Shaping Achieving 105dB SFDR and 101dB SNDR over 1kHz BW in 55nm CMOS,"In Paper 27.2, MediaTek introduces a DAC mismatch error-shaping technique. The 55nm CMOS prototype consumes 15.7?W and exhibits 96.1dB peak SNDR over 4kHz BW with a Schreier FOM of 180dB.","Yun-Shiang Shu, Liang-Ting Kuo, Tien-Yu Lo",Data for BW = 1kHz,,0.072,,1000,101,104,,,105.1,101,1.57E-05,1.00E+06,500,2.00E+03,7.85E+03,,85.6,,179,4.28E-02,212.05,ISSCC
2016,27.3,NQ,SAR,0.04,Area-Efficient 1GS/s 6b SAR ADC with Charge-Injection-Cell-Based DAC,"In Paper 27.3, University of Michigan presents a charge-injection DAC based SAR ADC to improve the DAC linearity, compactness, and speed. Fabricated in 40nm CMOS, this 6b 1GS/s ADC consumes 1.26mW from 1V power supply and occupies an area of only 0.00058mm2.","Kyojin D. Choo, John Bell, Michael P Flynn", ,0.2,0.00058,,500000000,34.6,,,,49.7,34.6,1.26E-03,1.00E+09,1,1.00E+09,1.26E+00,,28.7,,150.6,2.87E-08,240.59,ISSCC
2016,27.4,NQ,"Single-slope, SAR",0.028,A 0.35mW 12b 100MS/s SAR-Assisted Digital Slope ADC in 28nm CMOS,"In Paper 27.4, MediaTek combines a fine digital slope ADC with a coarse SAR ADC. At 100MS/s, the 28nm CMOS ADC achieves an SNDR of 64.4dB and an SFDR of 75.4dB at Nyquist input frequency, while consuming only 0.35mW from a 0.9V supply and occupying an area of 66?71?m2.",Chun-Cheng Liu, ,0.9,0.0047,65.7,50000000,64.4,,,,75.4,64.4,3.50E-04,1.00E+08,1,1.00E+08,3.50E+00,2.2,2.6,177.2,176,2.57E-08,255.98,ISSCC
2016,27.5,NQ,"Pipe, TI",0.065,A 4GS/s Time-Interleaved RF ADC in 65nm CMOS with 4GHz Input Bandwidth,"In Paper 27.5, Maxim presents a hierarchically time-interleaved ADC for wide-bandwidth communication applications. This 65nm 4GS/s RF ADC digitizes input frequencies up to 4GHz with an aperture jitter of 50fs rms, while consuming 2.2W. The ADC achieves 56.1dB SNR and 64dBc linearity at 1.842GHz input frequency.","Matt Straayer, Jim Bales, Dwight Birdsall, Denis Daly, Phillip Elliott, Bill Foley, Roy Mason, Vikas Singh, Xuejin Wang", ,,12,,182000000,55.5,56.1,,57,64,55.5,2.20E+00,4.00E+09,1,4.00E+09,5.50E+02,,1130,,145.1,2.83E-07,241.11,ISSCC
2016,27.6,NQ,"Pipe, TI",0.016,A 4GS/s 13b Pipelined ADC with Capacitor and Amplifier Sharing in 16nm CMOS,"In Paper 27.6, Broadcom presents a pipelined converter using capacitor and amplifier sharing. Implemented in 16nm FinFET, the 13b 4GS/s ADC occupies 0.34mm2 and consumes 300mW. It achieves 75dB peak SFDR, 68dB SFDR at Nyquist, -66dBFS noise level and 56dB SNDR at Nyquist.","Jiangfeng Wu,, Acer Chou, Tianwei Li, Rong Wu, Tao Wang, Giuseppe Cusmai, Sha-Ting Lin, Cheng-Hsun Yang, Gregory Unruh, Sunny Raj Dommaraju, Mo M. Zhang, Po Tang Yang, Wei-Ting Lin, Xi Chen, Dongsoo Koh, Qingqi Dou, H. Mohan Geddada, Juo-Jung Hung, Massimo Brandolini, Young Shin, Hung-Sen Huang, Chun-Ying Chen, Ardie Venes", ,,0.24,60,1900000000,56,,,,68,56,3.00E-01,4.00E+09,1,4.00E+09,7.50E+01,91.8,145.5,158.2,154.2,3.64E-08,250.26,ISSCC
2016,27.7,NQ,"SAR, TI",0.04,A 10b 2.6GS/s Time-Interleaved SAR ADC with Background Timing-Skew Calibration,"In Paper 27.7, National Taiwan University introduces a time-interleaved skew-correction technique based on signal-slope estimation. The 40nm CMOS 10b 2.6GS/s SAR ADC employing the technique achieves a 50.6dB SNDR at Nyquist rate while dissipating 18.4mW from a 1.1V power supply.","Chin-Yu Lin, Yen-Hsin Wei, Tai-Cheng Lee", ,0.6144,0.825,54.2,1300000000,50.6,,,,57.8,50.6,1.84E-02,2.60E+09,1,2.60E+09,7.08E+00,16.9,25.6,162.7,159.1,9.83E-09,253.24,ISSCC
2016,27.8,NQ,"Pipe, SAR, TI",0.028,A 0.076mm2 12b 26.5mW 600MS/s 4?-Interleaved Subranging SAR-?д ADC with On-Chip Buffer in 28nm CMOS,"In Paper 27.8, Marvell enables significant power and area reduction by combining SAR and incremental Delta-Sigma ADCs. The 12b 28nm 600MS/s 4? time-interleaved ADC with an on-chip buffer achieves an SNDR of 60.7dB at low input frequency and 58.0dB at high frequency, while consuming 26.5mW and occupying 0.076mm2.","Alessandro Venca, Nicola Ghittori, Alessandro Bosi, Claudio Nani", PLL jitter subtracted,,0.076,60.7,265000000,58,,,,66,58,2.65E-02,6.00E+08,1,6.00E+08,4.42E+01,49.9,68,161.2,158.5,1.13E-07,246.32,ISSCC
2016,28.6,OS,VCO,0.04,A с50mV Linear-Input-Range VCO-Based Neural-Recording Front-End with Digital Nonlinearity Correction,"In Paper 28.6, the University of California at Los Angeles proposes a front-end achieving a linear input-range of с50mV, which is a 10? improvement with respect to the range of previous designs. The SFDR is 79dB, which is 20dB higher than existing designs.","Wenlong Jiang, Vahagn Hokhikyan, Hariprasad Chandrakumar, Vaibhav Karkare, Dejan Markovic", ,,0.135,75.2,203,74,,,,79,74,7.00E-06,3.00E+03,8,4.00E+02,1.75E+04,3719.4,4272.5,149.8,148.6,1.07E+01,174.58,ISSCC
2017,16.1,NQ,"Pipe, SAR, TI",0.016,A 13b 4GS/s Digitally Assisted Dynamic 3-Stage Asynchronous Pipelined-SAR ADC,"In Paper 16.1, Xilinx presents a 13b 4GS/s asynchronous pipelined SAR ADC in 16nm CMOS. The ADC features multiple on-chip calibration loops that enable the use of open-loop integrator-based amplifiers thus achieving 57.3dB SNDR for a 1.9GHz input signal.","Bruno Vaz, Adrian Lynam, Bob Verbruggen, Asma Laraba, Conrado Mesadri, Ali Boumaalif, John Mcgrath, Umanath Kamath, Ronnie De Le Torre, Alvin Manlapat, Daire Breathnach, Christophe Erdmann, Brendan Farley", ,,1.04,63.8,1900000000,57.3,,,,67,57.3,5.13E-01,4.00E+09,1,4.00E+09,1.28E+02,101.3,214.2,159.7,153.2,5.35E-08,249.23,ISSCC
2017,16.2,OS,Pipe,0.028,A 9GS/s 1GHz-BW Oversampled Continuous-Time Pipeline ADC Achieving -161dBFS/Hz NSD ,"In Paper 16.2, Analog Devices introduces a 9GS/s 1GHz-BW oversampled continuous-time pipeline ADC in 28nm CMOS. This new ADC architecture simultaneously achieves the wide bandwidth of a pipeline ADC and the antialiasing properties of a continuous-time oversampled converter, reaching a -161dBFS/Hz NSD.","Hajime Shibata, Victor Kozlov, Zexi Ji, Asha Ganesan, Haiyang Zhu, and Donald Paterson", ,N/A,5.1,,1000000000,,66,73,,79,66,2.33E+00,9.00E+09,5,2.00E+09,1.17E+03,,714.5,,152.3,3.57E-07,245.34,ISSCC
2017,16.4,NQ,SAR,0.028,A 5mW 7b 2.4GS/s 1-then-2b/cycle SAR ADC with Background Offset Calibration,"In Paper 16.4, the University of Macau presents a 7b, 2.4GS/s SAR ADC in 28nm CMOS. The 1b-then-2b/cycle algorithm skips the DAC operation during the first cycle and enables background calibration of the comparator offsets, leading to a power consumption of 5mW.","Chi-Hang Chan, Yan Zhu, Iok-MengHo, WaiHong Zhang, Seng-Pan U2,3, RuiPaulo Martins", ,0.064,0.0043,40.1,1200000000,40.1,40.4,,,54.3,40.1,5.00E-03,2.40E+09,1,2.40E+09,2.08E+00,25.2,25.4,153.9,153.9,1.06E-08,247.65,ISSCC
2017,16.5,NQ,"SAR, TI",0.028,An 8GS/s Time-Interleaved SAR ADC with Unresolved Decision Detection Achieving -58dBFS Noise and 4GHz Bandwidth in 28nm CMOS ,"In Paper 16.5, Keysight Technologies introduces an 8GS/s SAR ADC with 4GHz bandwidth in 28nm CMOS achieving 60.3dB SFDR at 3.8GHz input. Detecting late comparator decisions lowers power consumption to 300mW while allowing for improved resolution and metastability error rate.","John P. Keane, Nathaniel J. Guilar, DusanStepanovic, Bernd Wuppermann, Charles Wu, CheongyuenW. Tsang, Robert Neff, Ken Nishimura ", ,,0.184,54.7,3820000000,49,52,,,60.3,49,3.00E-01,8.00E+09,1,8.00E+09,3.75E+01,84.1,162.9,156,150.2,2.04E-08,249.28,ISSCC
2017,16.7,NQ,"Pipe, TI",0.028,A 12b 10GS/s Interleaved Pipeline ADC in 28nm CMOS Technology ,"In Paper 16.7, Analog Devices describes a 12b pipeline ADC in 28nm CMOS sampling at 10GS/s, that incorporates multiple circuit, interleaving, calibration and randomization techniques. The ADC achieves 64dB SFDR and 55dB SNDR for a 4GHz input signal while consuming 2.9W.","S. Devarajan, L. Singer, D. Kelly, S. Kosic, T. Pan, J. Silva, J. Brunsilius, D. Rey-Losada, F. Murden, C. Speir, J. Bray, E. Otte, N. Rakuljic, P. Brown, T. Weigandt, Q. Yu, D. Paterson, C. Petersen, J. Gealow", ,,7.4,58.5,4000000000,55,56,,,66,55,2.90E+00,1.00E+10,1,1.00E+10,2.90E+02,421.8,631.2,150.9,147.4,6.31E-08,247.37,ISSCC
2017,21.6,NQ,SAR,0.18,A 12nW Always-On Acoustic Sensing and Object Recognition Microsystem using Frequency-Domain Feature Extraction and SVM Classification,"In Paper 21.6, the University of Michigan, Ann Arbor presents an ultra-low power acoustic sensing and object recognition microsystems for IoT applications. An ultra-low power 8b SAR-ADC with 50fF input capacitance enables a frontend amplifier with nW-level power consumption. A serialized discrete Fourier transform feature extraction is performed in a digital back-end, replacing a high-power/area-consuming conventional FFT. The overall system consumes 12nW while successfully identifying the target objects with better than 95% accuracy.","Seokhyeon Jeong, Yu Chen, Julius Tsai, Taekwang Jang, David Blaauw, Hun-Seok Kim, Dennis Sylvester", ,0.05,,,500,48.3,,,58,60,48.3,2.70E-09,1.00E+03,1,1.00E+03,2.70E+00,,12.7,,161,1.27E-02,190.98,ISSCC
2017,27.5,OS,SDSC,0.028,A pixel-pitch-matched ultrasound receiver for 3D photoacoustic imaging with integrated delta-sigma beamformer in 28nm UTBB FDSOI,"In Paper 27.5, Stanford University and STMicroelectronics present a 28nm ultrasound receiver for 3D photoacoustic imaging with the front-end and the modulator integrated within a 250?250жm2 pixel. The beamformer achieves 59.9dB SNR with a 7.4? area reduction over comparable prior-art solutions.","Man-Chia Chen, Aldo Pe¤a Perez, Sri-Rajasekhar Kothapalli, Philippe Cathelin, Andreia Cathelin, Sanjiv Sam Gambhir, Boris Murmann ", ,0.06,0.015625,,2000000,58.9,59.9,,,,58.9,6.65E-03,9.60E+08,48,2.00E+07,3.33E+02,,461.9,,150.7,2.31E-05,223.68,ISSCC
2017,28.1,OS,SAR,0.03,A 0.46mW 5MHz-BW 79.7dB-SNDR Noise-Shaping SAR ADC with Dynamic-Amplifier-Based FIR-IIR Filter ,"In Paper 28.1, MediaTek describes a 5MHz BW noise-shaping SAR ADC with a highly efficient dynamicamplifier-based FIR-IIR filter. Built in 28nm technology, the ADC consumes only 0.46mW and achieves a peak SNDR of 79.7dB with a Schreier FoM of 180.1dB.","Chun-Cheng Liu, Mu-Chen Huang",Numbers w/o chop,1.6,0.0049,,5000000,79.7,,81.8,,,79.7,4.60E-04,1.32E+08,13.2,1.00E+07,4.60E+01,,5.8,,180.1,5.83E-07,250.06,ISSCC
2017,28.2,OS,SDCT,0.13,An 11.4mW 80.4dB-SNDR 15MHz-BW CT Delta-Sigma Modulator Using 6b Double-Noise-Shaped Quantizer ,"In Paper 28.2, the University of Florida presents a 4th-order continuous-time delta-sigma modulator, employing a double noise-shaping quantizer, which incorporates both noise-shaped integrating and gated ring oscillator techniques. The prototype in 0.13?m CMOS consumes 11.4mW and exhibits 80.4dB peak SNDR over 15MHz BW.","Taewook Kim, Changsok Han, and Nima Maghari ", ,N/A,0.17,,15000000,80.4,81.7,82.9,,87.8,80.4,1.14E-02,6.40E+08,21.33,3.00E+07,3.80E+02,,44.4,,171.6,1.48E-06,246.36,ISSCC
2017,28.3,OS,"SDCT, VCO",0.02,A 125MHz-BW 71.9dB-SNDR VCO-Based CT ?д ADC with Segmented Phase-Domain ELD Compensation in 16nm CMOS ,"In Paper 28.3, MediaTek introduces a phase-domain excess-loop-delay compensation technique using a 128state segmented rotator in a VCO-based continuous-time delta-sigma modulator to achieve 125MHz BW. Fabricated in 16nm CMOS, this ADC achieves 74.8dB/-80dBc DR/THD with a FOMw of 67.2fJ/conv-step. ","Sheng-Jui Huang, Nathan Egan, Divya Kesharwani, Frank Opteynde, Michael Ashburn", ,N/A,0.217,,40000000,71.9,72.6,74.8,80,,71.9,5.40E-02,2.15E+09,8.6,2.50E+08,2.16E+02,,67.2,,165.5,2.69E-07,249.52,ISSCC
2017,28.4,NQ,"Pipe, SAR",0.065,A 12b 330MS/s Pipelined-SAR ADC with PVT-Stabilized Dynamic Amplifier Achieving <1dB SNDR Variation,"In Paper 28.4, the University of Texas at Dallas proposes a PVT-stabilized dynamic amplification technique for stable residue generation in a 12b 330MS/s pipelined-SAR ADC. The measured SNDR variation is less than 1dB for supply voltages from 1.25V to 1.35V and temperatures from -5шC to 85шC. ","Hai Huang, Sudipta Sarkar, Brian Elies, and Yun Chiu", ,1,0.08,67.7,165000000,63.5,,,,83.4,63.5,6.23E-03,3.30E+08,1,3.30E+08,1.89E+01,9.5,15.4,171.9,167.7,4.68E-08,252.92,ISSCC
2017,28.5,NQ,"Pipe, SAR",0.014,A 10b 1.5GS/s Pipelined-SAR ADC with Background Second-Stage Common-Mode Regulation and Offset Calibration in 14nm CMOS FinFET ,"In Paper 28.5, IBM presents a pipelined-SAR ADC that employs separate comparators per decision with background offset compensation and common-mode regulation of the 2nd stage. This 1.5GS/s ADC consumes 6.92mW and achieves over 50dB SNDR at Nyquist with an area of 0.0016mm2 implemented in 14nm CMOS. ","Lukas Kull, Danny Luu, Christian Menolfi, Matthias Braendli, Pier Andrea Francese, Thomas Morf, Marcel Kossel, Hazar Yueksel, Alessandro Cevrero, IlterOzkaya, Thomas Toifl", ,,0.0016,,750000000,50.1,50.9,,58.2,58.4,50.1,6.92E-03,1.50E+09,1,1.50E+09,4.61E+00,,17.7,,160.4,1.18E-08,252.21,ISSCC
2017,28.6,NQ,SAR,0.065,A 78.5dB-SNDR Radiation- and Metastability-Tolerant Two-Step Split SAR ADC Operating up toя75MS/s with 24.9mW Power Consumption in 65nm CMOS,"In Paper 28.6, the University of Texas at Dallas introduces a 5MS/s two-step split SAR ADC, incorporating single event effect error-detection techniques to achieve a 100% error-correction rate in an irradiation test with proton beams. The 65nm CMOS prototype demonstrates a 78.5dB peak SNDR and over 100dB peak SFDR at 35MS/s and consumes 24.9mW at 75MS/s. ","Hongda Xu, Yongda Cai, Ling Du, Yuan Zhou, Benwei Xu, Datao Gong, Jingbo Ye, and Yun Chiu ", ,,0.34,77.8,37500000,70.8,,,,89.6,70.8,2.49E-02,7.50E+07,1,7.50E+07,3.32E+02,52.3,117.2,169.6,162.6,1.56E-06,241.33,ISSCC
2017,28.7,NQ,"Pipe, SAR",0.028,A 0.7V 12b 160MS/s 12.8fJ/conv-step Pipelined-SAR ADC in 28nm CMOS with Digital Amplifier Technique ,"In Paper 28.7, Toshiba describes a digital amplifier technique to cancel out all the errors from the low-gain residue amplifier. The 28nm 12b 160MS/s pipelined-SAR ADC employing the proposed technique achieves a 61.1dB SNDR at Nyquist while dissipating 1.9mW from a 0.7V power supply. ","Kentaro Yoshioka, Tomohiko Sugimoto, Naoya Waki, Sinnyoung Kim, Daisuke Kurose, Hirotomo Ishii, Masanori Furuta, Akihide Sai and Tetsuro Itakura ", ,,0.097,62,80000000,61.1,63,,,72.7,61.1,1.90E-03,1.60E+08,1,1.60E+08,1.19E+01,11.5,12.8,168.2,167.3,8.00E-08,249.38,ISSCC
2017,29.2,NQ,"SAR, TI",0.02,A Transmitter and Receiver for 100Gb/s Coherent Networks with Integrated 4?64GS/s 8b ADCs and DACs in 20nm CMOS ,"In Paper 29.2, Broadcom reports the first integrated receiver and transmitter in a 100G coherent DSP chip using 4x64GS/s ADCs and DACs in 20nm CMOS. By supporting 100Gb/s coherent transmission, the overall speed of the transceiver is the fastest among all reported data-converter-based transmitters or receivers.","Jun Cao, Delong Cui, Ali Nazemi, Tim He, Guansheng Li, Burak Catli, Mehdi Khanpour, Kangmin Hu, Tamer Ali, Heng Zhang, Hairong Yu, Ben Rhew, Shiwei Sheng, Yonghyun Shim, Bo Zhang, Afshin Momtaz",Power includes front-end,,,39.7,8000000000,37.6,,,,,37.6,9.50E-01,6.40E+10,1,6.40E+10,1.48E+01,188.4,240.1,145,142.9,3.75E-09,250.92,ISSCC
2018,5.7,OS,SAR,0.028,A 20ch TDC/ADC Hybrid SoC for 240?96-Pixel 10%-Reflection <0.125%-Precision 200m-Range Imaging LiDAR with Smart Accumulation Technique,"In Paper 5.7, Toshiba presents a TDC/ADC hybrid LiDAR SoC with a smart accumulation technique (SAT) to achieve 200m range imaging with 240?90 pixel resolution for reliable self-driving systems. The SAT using ADC information enhances the effective pixel resolution with an accumulation activated by recognizing only the target reflection, while the hybrid architecture enables a wide measurement range from 0 to 200m.","Kentaro Yoshioka, Hiroshi Kubota, Tomonori Fukushima, Satoshi Kondo, Tuan Thanh Ta, Hidenori Okuni, Kaori Watanabe, Yoshinari Ojima, Katsuyuki Kimura, Sohichiroh Hosoda, Yutaka Oota, Tomohiro Koizumi, Naoyuki Kawabe, Yasuhiro Ishii, Yoichiro Iwagami, Seitaro Yagi, Isao Fujisawa, Nobuo Kano, Tomohiro Sugimoto, Daisuke Kurose, Naoya Waki, Yumi Higashi, Tetsuya Nakamura, Yoshikazu Nagashima, Hirotomo Ishii, Akihide Sai, Nobu Matsumoto", ,,0.011,,100000000,37.7,,,,,37.7,1.00E-03,4.00E+08,2,2.00E+08,5.00E+00,,79.8,,147.7,3.99E-07,230.71,ISSCC
2018,14.1,OS,SDCT,0.028,A 50MHz-BW Continuous-Time ?д ADC with Dynamic Error Correction Achieving 79.8dB SNDR and 95.2dB SFDR,"In Paper 14.1, Oregon State University and MediaTek present an efficient dynamic error correction technique for an NRZ feedback DAC in a  ntinuous-time delta-sigma ADC. The 28nm ADC achieves 80dB SNDR in a 50MHz bandwidth while consuming 64.3mW.","Tao He, Michael Ashburn, Stacy Ho, Yi Zhang, Gabor Temes", ,,0.25,,50000000,79.8,80,82.8,94.1,,79.8,6.43E-02,2.00E+09,20,1.00E+08,6.43E+02,,80.5,,168.7,8.05E-07,248.71,ISSCC
2018,14.2,OS,SDCT,0.04,A 15.2-ENOB Continuous-Time ?д ADC for a 7.3?W 200mVpp-Linear-Input-Range Neural Recording Front-End,"In Paper 14.2, the University of California, Los Angeles describes a capacitively coupled continuous-time delta-sigma ADC for a neural recording front-end in 40nm CMOS. Chopping and linearity enhancement techniques are key to demonstrating 15.2b-ENOB with only 4.5uW in 5kHz bandwidth.","Hariprasad Chandrakumar, Dejan Markovi?", ,,0.053,,1000,93.5,94.3,103,,106,93.5,4.50E-06,4.00E+05,40,1.00E+04,4.50E+02,,11.6,,184,1.16E-03,223.96,ISSCC
2018,14.3,OS,SAR,0.04,A 13-ENOB 2nd-Order Noise-Shaping SAR ADC Realizing Optimized NTF Zeros Using an Error-Feedback Structure,"In Paper 14.3, the University of Texas at Austin proposes an error feedback structure with a passive FIR and re-used comparator to realize complex noise transfer function zeros in a noise-shaping SAR ADC.
Clocked at 10MHz, the 40nm ADC realizes 79dB SNDR in 625kHz bandwidth and consumes 84uW.","Shaolan Li, Bo Qiao, Miguel Gandara, Nan Sun",Calibration power 4uW not included,,0.024,,625000,79,,80.5,,89,79,8.40E-05,1.00E+07,8,1.25E+06,6.72E+01,,9.2,,177.7,7.38E-06,238.69,ISSCC
2018,14.4,OS,"Incremental, SDSC",0.18,A 1.1mW 200kS/s Incremental ?д ADC with a DR of 91.5dB Using Integrator Slicing for Dynamic Power Reduction,"In Paper 14.4, the University of Ulm introduces an integrator slicing technique in an incremental delta-sigma ADC that allows for improved noise and power tradeoffs in the front-end integrator stages. The 200kS/s prototype in 0.18?m CMOS achieves 91.5dB dynamic range and 1.1mW.","Patrick Vogelmann, Michael Haas, Maurits Ortmanns",VDD=3V,0.7,0.363,,100000,86.6,88.2,91.5,,101.3,86.6,1.10E-03,3.00E+07,150,2.00E+05,5.50E+03,,314.7,,166.2,1.57E-03,219.2,ISSCC
2018,14.5,OS,SDSC,0.16,A 280?W Dynamic-Zoom ADC with 120dB DR and 118dB SNDR in 1kHz BW,"In Paper 14.5, Delft University of Technology presents a dynamic zoom ADC with a high-speed asynchronous SAR that works in tandem with a delta-sigma. Fabricated in 0.16?m CMOS, the ADC reaches 118dB SNDR in a 1kHz bandwidth while consuming 280uW.","Shoubhik Karmakar, Burak G”nen, Fabio Sebastiano, Robert Van Veldhoven, Kofi A. A. Makinwa", ,13,0.25,,1000,118.1,119.1,120.3,125.9,,118.1,2.78E-04,2.00E+06,1000,2.00E+03,1.39E+05,,211.6,,183.7,1.06E-01,216.67,ISSCC
2018,14.6,NQ,SAR,0.09,A 0.4V 13b 270kS/s SAR-ISDM ADC with an Opamp-Less Time-Domain Integrator,"In Paper 14.6, National Tsing Hua University proposes a single-path time-domain voltage-controlled delay line for use in a coarse SAR comparator and a fine incremental delta-sigma integrator to realize a 13b ADC. Power consumption is only 638nW at 270kS/s with 11.9b ENOB.","Sung-En Hsieh, Chih-Cheng Hsieh", ,2.8,0.059,,135000,73.6,,,,90.4,73.6,6.38E-07,2.70E+05,1,2.70E+05,2.36E+00,,0.6,,186.8,2.25E-06,241.14,ISSCC
