YEAR,ID,TYPE,ARCHITECTURE,TECHNOLOGY,TITLE,ABSTRACT,AUTHORS,COMMENTS,Csamp [pF],AREA [mm^2],SNDR_lf [dB],fin_hf [Hz],SNDR_hf [dB],SNR [dB],DR [dB],-THD [dB],SFDR [dB],SNDR_plot [dB],P [W],fs [Hz],OSR,fsnyq [Hz],P/fsnyq [pJ],FOMW_lf [fJ/conv-step],FOMW_hf [fJ/conv-step],FOMS_lf [dB],FOMS_hf [dB],FOMW_hf/fsnyq,"FOMS,hf+10log(fsnyq)",source
1997,8.1,NQ,SAR,1,"A MOSFET-only, 10 b, 200 ksample/s A/D converter capable of 12 b untrimmed linearity","The linearity of a successive approximation (SA) A/D converter is typically limited by its passive network. Published converters based on capacitive arrays or resistive ladders are limited to around 10 b if no trimming or calibration is used. Although static measurements show that MOS transistors are capable of excellent matching, few MOSFET-only converters achieved more than 10 b accuracy without self-calibration. This A/D converter adopts the current division ladder network based on MOSFETs. Extensive measurements on the MOSFET ladders with different resolutions and geometry establish the achievable linearity ","Hammerschmied, C.; Qiuting Huang", , ,2.155,,100000,56.5,,,,,56.5,1.20E-02,2.00E+05,1,2.00E+05,6.00E+04,,109339.8,,125.8,5.47E-01,178.76,ISSCC
1997,8.2,NQ,Folding,1.00 BiCMOS,A 12 b 50 M sample/s cascaded folding and interpolating ADC,"The architecture of this 12 b ADC is based on a three-stage conversion, using cascaded folding and interpolating techniques. Compared to other multi-stage ADC architectures, folding and interpolating ADCs are based on non-linear analog pre-processing. This architecture is an attractive solution for high-resolution ADCs, as extremely linear circuit topologies are not required. To increase the resolution of folding and interpolating ADCs above the published 8 b examples, without raising the number of parallel input stages or the number of comparators in the fine-comparator, a cascaded folding and interpolating architecture is introduced. The ADC achieves 64 dB signal-to-noise ratio (SNR) and 75 dB spurious-free dynamic range (SFDR), while quantizing a 15 MHz full-scale input signal at 50 MSample/s. The 7.0 mm2 ADC is fabricated in a 13 GHz, 1 ?m BiCMOS process and dissipates 300 mW from a single 5.0 V supply. The device is mounted in a standard 44-pin plastic package ","Vorenkamp, P.; Roovers, R.", , ,7,,25000000,,64,,,75,64,3.00E-01,5.00E+07,1,5.00E+07,6.00E+03,,4632.8,,143.2,9.27E-05,220.2,ISSCC
1997,8.3,NQ,Folding,0.5,A 170 mW 10 b 50 Msample/s CMOS ADC in 1 mm2,"This 10 b AD-converter at a sample rate of 5O MSample/s, embedded in 50mm2 of digital circuitry, shows 8.7 effective bits. A straight flash-architecture would need 1023 accurate fast comparators. With a 2 V input range, a comparator offset voltage of no more than 1 mV can be tolerated. Taking into account that the 1 mV is a 3-6 sigma value, leads to a large chip. If, however, the signals to the comparator are amplified before the critical decision, simple small comparators would suffice. To cope with the dynamic offset caused by the clocking and latch action of the comparator itself, the architecture must tolerate comparator offsets of up to 60-80 mV. Hence, a gain of at least 30 is necessary. A single amplifier however, could not handle this, as the input range of 2 V would be amplified to 60 V. The approach here is to use a distributed amplifier ","Bult, K.; Buchwald, A.; Laskowski, J.", , ,1,,25000000,53.5,,,,,53.5,1.70E-01,5.00E+07,1,5.00E+07,3.40E+03,,8762.4,,135.2,1.75E-04,212.2,ISSCC
1997,8.4,NQ,Two-step,Bipolar,A 12 b 128 MSample/s ADC with 0.05 LSB DNL,"This analog-to-digital converter uses integrated dither, dynamic element matching, and output data scrambling to achieve SFDR of 85dB and DNL below 0.05LSB at l28MSample/s. This compares to about 0.5LSB DNL for slower 12b converters. The basic two-step flash architecture is shown. The с0.25V input is amplified to с1V and held in the track-and-hold circuit when the input clock rises. The 32 comparators in ADC1 produce an approximation that switches the 32 matched current sources in the main DAC. The residue is formed and amplified in the summer to с0.5V and is converted by ADC2, an 8b folding-and-interpolating flash ADC. To allow low clock rates, there is no analog pipelining, and all analog settling from the track-to-hold transition to latching the result in ADC2 takes only 4.4ns. The ADC1 and ADC2 results added together form the 12b output. The total signal-to-data-output delay is slightly more than two cycles due to digital pipelining","Jewett, R.; Poulton, K.; Kuo-Chiang Hsieh; Doernberg, J.", , ,,,64000000,,58.4,,,,58.4,5.70E+00,1.28E+08,1,1.28E+08,4.45E+04,,65521.3,,128.9,5.12E-04,209.98,ISSCC
1997,8.8,NQ,Pipe,1.4,A 15 b 5 MSample/s low-spurious CMOS ADC,"This 15b CMOS ADC at 5MSample/s has four stages with 5, 5, 5, and 6b each. The number of bits resolved per stage is set higher to achieve the same resolution with less accurate components. Resolving more bits per stage greatly simplifies op amp design and reduces the initial capacitor matching requirement. Furthermore, residue amplifiers with low feedback factors are less sensitive to summing-node parasitics. The first two 5b stages are calibrated using the remaining part of the ADC. Two stages are selected for calibration. The gain ofthe 5b residue amplifier is set to 16 to make room for digital correction. After digital correction, the chip has an 18b output. Performance up to 16b level can be tested after removing 2 LSBs corrupted by digital processing. System partitioning and multi-stage calibration solve two fundamental problems of capacitor matching and finite opamp gain ","Sung-Ung Kwak; Bang-Sup Song; Bacrania, K.",Power includes digital (addtl. 70mW), ,27.28,,2500000,84.9,86.9,,,93,84.9,1.30E-01,5.00E+06,1,5.00E+06,2.60E+04,,1809.5,,157.7,3.62E-04,224.73,ISSCC
1997,13.1,OS,"SDSC, Pipe",0.6,A 16b д? pipeline ADC with 2.5 MHz output data-rate,"A 16b 2.5 MHz A/D converter in 0.6 ?m CMOS addresses the need for wide dynamic range A/D converters with bandwidths in excess of 1 MHz in multi-tone communication. This A/D converter combines the advantages of д? and pipeline A/D conversion techniques to provide wide dynamic range at a low-oversampling ratio. The device operates at a 20 MHz clock rate, 2.5 MHz output rate (8? oversampling), and provides 89 dB SNR over a 1.25 MHz input bandwidth ","Brooks, T.L.; Robertson, D.H.; Kelly, D.F.; Del Muro, A.; Harston, S.W.", , ,31.8,,1250000,,89,,,97,89,5.50E-01,2.00E+07,8,2.50E+06,2.20E+05,,9549.7,,152.6,3.82E-03,216.54,ISSCC
1997,13.2,OS,SDSC,0.5,Low-voltage double-sampled д? converters,"In theory, double-sampling in second-order д? analog-to-digital converters (ADC) can enhance the signal-to-noise ratio (SNR) by 15 dB. In practice however, the SNR performance is usually severely degraded because of mismatches occurring in switched-capacitors (SC). This paper introduces a simple method to solve this problem. Regarding д? digital-to-analog converters (DAC), in addition to double-sampling, the accompanying use of internal decimation helps to relax the bandwidth requirements of the opamps. Both circuitries are to be operational to supply voltages as low as 1.5 V by using clock bootstrapping. Chip implementation is in double-poly, 2-metal technology featuring 0.5 ?m minimum channel lengths","Senderowicz, D.; Nicollini, G.; Pernici, S.; Nagari, A.; Confalonieri, P.; Dallavalle, C.", , ,0.39,,1000,81,,88,,,81,5.50E-04,1.00E+06,500,2.00E+03,2.75E+05,,29987.3,,143.6,1.50E+01,176.61,ISSCC
1997,13.3,OS,"SDSC, TI",0.6,A two-path bandpass д? modulator for digital IF extraction at 20 MHz,"There is expanding interest in the possibility of moving the intermediate frequency (IF) signal processing in radio receivers and radio test equipment from the analog domain into the digital domain. Digitization of IF processing confers several important advantages, including greater reliability, potentially lower power consumption, and improved performance as technology scales. Unfortunately, as analog signal processing is eliminated and the A/D conversion is moved away from baseband, the signal that must be digitized has a larger dynamic range, and the converter must operate at a higher sampling rate. This work introduces a two-path, switched-capacitor architecture for a bandpass д? modulator that is suited to digitizing narrowband radio signals with large dynamic range. A fourth-order bandpass modulator is implemented in a standard 0.6 ?m, single-poly, triple-metal CMOS process. Operating from a single 3.3 V supply, the modulator digitizes a 200 kHz signal centered at an IF of 20 MHz with an extrapolated dynamic range of 75 dB ","Ong, A.K.; Wooley, B.A.",IF=20MHz, ,2.73,,200000,75,,75,,,75,7.20E-02,4.00E+07,100,4.00E+05,1.80E+05,,39165.9,,139.4,9.79E-02,195.46,ISSCC
1997,13.4,OS,SDCT,HBT,A bandpass д? modulator with 92 dB SNR and center frequency continuously programmable from 0 to 70 MHz,"Use of a bandpass д? modulator permits direct conversion of an analog signal to digital form at IF frequencies. This allows the ADC to be moved closer to the receiver front end. Moving the digital interface closer to the antenna reduces receiver analog circuit complexity, eliminates DC-offset cancellation, inphase/quadrature (I/Q) gain calibration, dual I/Q mixers and improves system robustness as mixing is in the digital domain. This second-order bandpass д? modulator is targeted for an airborne radar system but is also expected to find use in a variety of communications applications. Measurements yield signal to noise+distortion ratio (SNR) from 92 dB (15 b) in narrowband ( 366 kHz) to 44 dB (7 b) in broadband (62.6 MHz) about a center frequency of 55.5 MHz. Modulator sampling rate is 4 GHz and it is implemented in AlInAs-InGaAs HBT technology. The performance represents an improvement of approximately a factor of 10 in bandwidth, resolution and center frequency over other reported bandpass modulators ","Raghavan, G.; Jensen, J.F.; Walden, R.H.; Posey, W.P.","Data taken for max. BW, IF=55MHz", ,0.5625,,62600000,44.1,,,,,44.1,1.40E+00,4.00E+09,32,1.25E+08,1.12E+04,,85371.5,,120.6,6.82E-04,201.58,ISSCC
1997,13.5,OS,"SDCT, Complex",0.8,A quadrature bandpass д? modulator for digital radio,"In a bandpass д? modulator, bandpass filtering and feedback around a low-resolution quantizer shape the noise spectrum, facilitating accurate A/D conversion on narrow-band input signals. This is extended to the quadrature, or complex, case if a complex filter - having complex-valued coefficients and thus not restricted to a symmetrical frequency response - is placed in a д? loop. The modulator performs a ?complex? A/D conversion on the pair of analog inputs, that are in phase-quadrature, and it has two high-speed bit stream outputs: one represents the real output; the other the imaginary output. When combined, these outputs form a complex signal that accurately represents the complex input within a narrow frequency band. This quadrature modulator is useful in architectures for a single-chip digital-radio receiver. The receiver ideally has no image response, and thus the bulky narrow-band image-rejection filter in the RF stage of a single-path receiver can be replaced with a broadband one. The architecture alleviates many problems of the direct-conversion receiver, often considered for single-chip implementations, since the input signal is mixed to a non-zero IF where 1/f noise and DC offsets cause no problem and self-interference is not an issue because oscillator frequency is offset from the carrier frequency. The quadrature modulator IC uses standard fully-differential switched-capacitor circuit techniques and is implemented in 0.8 ?m CMOS technology ","Jantzi, S.; Martin, K.; Sedra, A.","Data taken for max. BW, IF=3.75MHz", ,4.32,,200000,62,,67,,,62,1.30E-01,1.00E+07,25,4.00E+05,3.25E+05,,315924.4,,123.9,7.90E-01,179.89,ISSCC
1997,13.6,OS,SDSC,0.8,"A 5 V, 118 dB д? analog-to digital converter for wideband digital audio","Digital signal processing can replace analog signal processing in professional audio equipment only when analog-to-digital converter dynamic ranges approach 120 dB. Super-high-end audio applications extend the audio band beyond 30 kHz and require 96 kHz sampling frequency. This paper describes a multi-bit д? modulator developed for high-end digital audio. The modulator is a single-loop, seventh-order type with a 3-level quantizer. The modulator samples the analog input at 6.144 MHz and has 140 dB signal-to-quantization noise in a 48 kHz bandwidth. The device is fabricated in a double-poly, double-metal, 0.8 ?m CMOS process ","Leung, K.Y.; Swanson, E.J.; Kafai Leung; Zhu, S.S.", , ,25,,48000,110,,118,,,110,7.60E-01,6.14E+06,64,9.60E+04,7.92E+06,,30619.8,,158,3.19E-01,207.83,ISSCC
1997,13.7,OS,SDCT,0.5,A 2.3 mW CMOS д? modulator for audio applications,"This audio-quality CMOS д? modulator operates from a 3.3 V supply with 2.3 mW power consumption. The dynamic range is 96 dB over a 20-20000 Hz bandwidth and THD for a 1 kHz maximum input signal is -104 dB. A modulator with power consumption increased to 6.6 mW at the same supply voltage has 10l dB dynamic range and THD<-110 dB, proving the tradeoff between power consumption and performance ","van der Zwan, E.J.", , ,0.4,,20000,,,96,104,,96,2.30E-03,5.64E+06,141,4.00E+04,5.75E+04,,1114.8,,165.4,2.79E-02,211.41,ISSCC
1998,4.4,OS,SDSC,0.6,A 100 kHz 9.6 mW multi bit ?д DAC and ADC using noise shaping dynamic elements matching with tree structure,"A multi-bit ?д modulator (?дM) is an attractive means for realizing a high-speed low-power data converter. A loss in dynamic range occurs if stabilization of the feedback loop for a higher-order DSM uses a 1b feedback signal. The classical 1b ADC and/or DAC do not follow the theoretical SNR of (8+6 N)L(dB), where N is the order of the DSM, and 2L is the oversampling ratio. In contrast, multi-bit feedback stabilizes a higher-order DSM with little loss of dynamic range. As the internal signal swing is reduced with increase in number of feedback signal bits, the multi-bit DSM requires a lower slew rate and thus less power for analog circuits than the 1b case. There is an increase in SNR due to use of a multi-bit internal DAC to reduce the oversampling ratio and hence to reduce power consumption of the analog portion ","Yasuda, A.; Tanimoto, H.; Lida, T.", , ,,,100000,,,79,75,,75,9.60E-03,5.00E+06,25,2.00E+05,4.80E+04,,10444.2,,145.2,5.22E-02,198.19,ISSCC
1998,4.6,OS,"SDSC, SwOpAmp",0.5,A 900 mV 40 ?W switched opamp ?д modulator with 77 dB dynamic range,"Portable electronic systems require low-voltage low-power building blocks. An important building block is an A/D converter. ?д ADCs provide an efficient way of trading off speed for resolution. The switched op amp (SO) technique allows design of switched-capacitor (SC) circuits at very low supply voltage without the use of multithreshold technologies or voltage multipliers to drive the switches. The basic idea of it is to leave out the switches connected to the output of the amplifier in a SC integrator, because those are the ones that fail to conduct when the supply voltage is low. Switches can only be connected to well-chosen reference voltages. In this implementation the differential modified SO integrator cell is used, so the reference voltages are VSS and VDD. This allows maximum overdrive of VDD-VSS for the switches ","Peluso, V.; Vancorenland, P.; Marques, A.; Steyaert, M.; Sansen, W.", , ,0.85,,16000,62,,77,,,62,4.00E-05,1.54E+06,48,3.20E+04,1.25E+03,,1215.1,,148,3.80E-02,193.07,ISSCC
1998,9.1,NQ,Pipe,0.7,A single-ended 12b 20Msample/s self-calibrating pipeline A/D converter,This single-ended 12b 20 MSample/s pipeline ADC has good performance for Nyquist frequency inputs. Architecture and calibration algorithms minimize digital correction circuitry and noise crosstalk. The single-ended performance is achieved with a novel input common-mode feedback technique in the S/H stage. The total power dissipation is only 250 mW from a single 5 V supply,"I. Opris, L. Lewicki, and B. Wong", , ,9,,10000000,,65.4,,70.6,,65.4,2.50E-01,2.00E+07,1,2.00E+07,1.25E+04,,8214.7,,141.4,4.11E-04,214.43,ISSCC
1998,9.2,NQ,"Pipe, TI",1,Digital background calibration of a 10b 40Msample/s parallel pipelined ADC,This time-interleaved pipelined ADC uses monolithic digital background calibration to overcome the effects of the offset and gain mismatches between channels. The contributions here are use of digital background calibration to overcome these mismatches and implementation of these techniques in conjunction with the ADCs on one CMOS IC. Background calibration is done by adding a calibration signal to the ADC input and processing both simultaneously. A potential advantage of this approach is that the calibration signal acts as dither and improves the linearity of the system ,"D. Fu, K. Dyer, S. Lewis, and P. Hurst,", , ,22,,20000000,55,,55,,72,55,5.65E-01,4.00E+07,1,4.00E+07,1.41E+04,,30741.4,,130.5,7.69E-04,206.51,ISSCC
1998,9.3,NQ,"Pipe, TI",1,Analog background calibration of a 10b 40Msample/s parallel pipelined ADC,"The sampling rate of an ADC often limits speed of a signal processing system. Sampling rate at the A/D interface can be increased by using multiple component ADCs that are time interleaved. Mismatches in offsets, gains, and sampling times among the component ADCs limit the performance of the ADC system. Previous time-interleaved ADC arrays use careful layout, foreground calibration and/or digital filters to minimize the effects of these mismatches. The presented time-interleaved ADC uses monolithic analog background calibration to match the gains and offsets of the component pipelined ADCs. The contributions are an expandible adaptive background calibration technique for parallel ADCs and a calibration loop that uses a mixed-signal integrator. The fully-differential prototype is fabricated in a 1.0 ?m CMOS single-poly process with poly-thin-oxide-diffusion capacitors. It includes 3 pipelined ADCs, one algorithmic ADC, the calibration signal generator, channel control logic, and 6 mixed-signal integrators, each followed by a unity-gain buffer that supplies the offset or reference correction voltage to one of the pipelined ADCs. The SC integrator and ADC stages use telescopic opamps with source followers at the input ","K. Dyer, D. Fu, S. Lewis, and P. Hurst,", , ,42,,20000000,58,,,,,58,6.50E-01,4.00E+07,1,4.00E+07,1.63E+04,,25036.5,,132.9,6.26E-04,208.9,ISSCC
1998,9.4,NQ,Pipe,0.5,A continuously-calibrated 10Msample/s 12b 3.3V ADC,"Continuous calibration allows a converter to function continuously in the presence of environmental fluctuations and supply variations by periodically correcting for errors without interrupting the ADC output. This paper introduces a technique for continuously calibrating a pipelined A/D converter. Calibration is performed in the analog domain so as to avoid high-linearity calibration hardware or complex signal processing. A 10 MS ample/s, 12b converter implemented in a conventional 0.5 ?m, single-poly, four-metal, CMOS technology operates from a 3.3V supply. This experimental circuit digitizes a 4.8 MHz signal with a peak SNDR of 67 dB ",Joseph Ingino Jr. and Bruce Wooley, , ,14.5,,5000000,67,,,,,67,2.65E-01,1.00E+07,1,1.00E+07,2.65E+04,,14485.1,,139.8,1.45E-03,209.76,ISSCC
1998,9.5,NQ,"Pipe, TI",0.5,8b 75Msample/s 70mW parallel pipelined ADC incorporating double sampling,This 8b pipelined analog-to-digital converter (ADC) incorporates double sampling into the residue signal path of a 1.5b-per-stage architecture to effectively double the throughput of the ADC for a given analog power consumption. Residue amplifiers and sub-ADC comparators are shared between two time-interleaved channels and the sampling capacitors in the second stage are scaled in order to reduce power consumption. The ADC presented here achieves 75 MSamples/s while consuming 70 mW. The converter measures 5.5 mm2 and is fabricated in a 3.3 V 0.5 ?m digital CMOS process with four levels of metal and no special mask layers for passive components,W. Bright,, ,5.5,,37500000,43.3,46.3,47,,51,43.3,7.00E-02,7.50E+07,1,7.50E+07,9.33E+02,,7813.2,,130.6,1.04E-04,209.34,ISSCC
1998,9.6,NQ,Flash,0.35 BiCMOS,A 5.75b 350Msample/s or 6.75b 150Msample/s reconfigurable flash ADC for a PRML read channel,"A reconfigurable flash analog-to-digital converter (ADC), is suited for use in a partial response maximum likelihood (PRML) read channel with digital servo. A 5V version is integrated in a read channel with digital servo using BiCMOS technology","P. Setty, J. Barner, J. Plany, H. Burger, and J. Sonntag", , ,0.75,,175000000,31,,,,,31,2.25E-01,3.50E+08,1,3.50E+08,6.43E+02,,22180.4,,119.9,6.34E-05,205.35,ISSCC
1998,9.7,NQ,Folding,0.50 BiCMOS,A 400Msample/s 6b CMOS folding and interpolating ADC,"A 6b 400 MSample/s folding and interpolating CMOS ADC uses a low-impedance current-mode approach. Current division interpolation in the folders allows fast low-voltage operation. This interpolation together with a short aperture comparator, gives good performance for high-frequency inputs, without using a sample-and-hold. The ADC uses a single clock and its complement. The 0.6 mm2 CMOS converter, fabricated in a 0.5 ?m BiCMOS process dissipates 200 mW from a 3.2 V supply ","M. Flynn and B. Sheahan,", , ,0.6,,200000000,29.2,,,33.6,,29.2,2.00E-01,4.00E+08,1,4.00E+08,5.00E+02,,21224.3,,119.2,5.31E-05,205.22,ISSCC
1999,3.1,OS,SDSC,0.5,A 1.5 V 1.0 mW audio ?д modulator with 98 dB dynamic range,"This audio-quality switched-capacitor (SC) ?д modulator operates from a single 1.5 V supply and dissipates 1.0 mW. When clocked at 2.82 MHz, it achieves 98.2 dB dynamic range (DR) in a 20 kHz bandwidth. The peak SNR and SNDR are 90 dB and 88 dB, respectively. The fully-differential experimental circuit has been integrated in a 0.5 ?m triple-metal single-poly CMOS n-well process with metal-to-poly capacitors.",A.L. Coban; P.E. Allen, , ,0.53,,20000,88,90,98.2,,,88,1.01E-03,2.82E+06,71,4.00E+04,2.51E+04,,1223.7,,161,3.06E-02,207.01,ISSCC
1999,3.2,OS,SDCT,0.35,A 1.8 mW CMOS д? modulator with integrated mixer for A/D conversion of IF signals,"This CMOS IFд? modulator combines the functions of an IF mixer and an anti-aliasing filter with a continuous-time (CT) baseband д? modulator for A/D conversion of IF signals in radio receivers. Advantage is taken of the high linearity and low-power of the CT baseband д? modulator. The resulting IFд? modulator consumes 1.8 mW and has +36 dBV IP3. The IF д? modulator of this paper is for mobile phones (GSM specification), and is promising for application in other types of receivers ","Breems, L.J.; van de Zwan, E.J.; Dijkmans, E.C.; Huijsing, J.H.", , ,0.2,,100000,84,,86,,,84,1.80E-03,1.30E+07,65,2.00E+05,9.00E+03,,694.8,,161.4,3.47E-03,214.46,ISSCC
1999,3.3,OS,"SDSC, Pipe",1.2,A Nyquist-rate pipelined oversampling A/D converter,"Oversampling and noise-shaping techniques, such as д? modulation, have an inherent tradeoff between accuracy and speed, whereby resolution in amplitude is at the expense of resolution in time. Because their internal circuits must operate over many clock cycles to produce a single result, they have limited data rates and power dissipation is a concern. Much attention has been focused on improving the speed and power of д? analog-to-digital converters (ADCs) by use of higher-order modulators, multi-bit feedback, and multi-bit architectures with single-bit feedback. However, data rates remain limited to less than a few MHz and are not easily extended. A pipelined oversampling architecture circumvents this speed-resolution tradeoff by performing spatial, rather than temporal, oversampling. It combines the high resolution of дл techniques with the high speed of pipelined converters so that both of these attributes are simultaneously achievable ","Paul, S.; Hae-Seung Lee; Goodrich, J.; Alailima, T.; Santiago, D.", , ,47,,9000000,71,74,78,,78,71,3.24E-01,1.80E+07,1,1.80E+07,1.80E+04,,6207.7,,145.4,3.45E-04,217.99,ISSCC
1999,3.4,OS,SDCT,0.5,A 6th-order continuous-time bandpass д? modulator for digital radio IF,"A bandpass SD Modulator (SDM) ADC uses negative feedback of a bandpass-filtered error-signal and a high oversampling ratio to reduce the in-band errors of a low-resolution quantizer. As high-order (>4) bandpass SDMs exhibit signal-dependent stability, multibit quantizers are often used to lower the quantization noise of a 2nd or 4th order SDM. However, the accuracy required of the intermediate quantizer levels is high as mismatch affects the overall SDM performance. A 6th-order SDM has a single-bit quantizer for digitizing IF signals of 10.7 MHz ","van Engalen, J.; van de Plassche, R.; Sokvoort, E.; Venes, A.","Data for 10.7MHZ IF, BW=200kHz", ,0.36,,200000,63.5,,67,,,63.5,6.00E-02,8.00E+07,200,4.00E+05,1.50E+05,,122682.8,,128.7,3.07E-01,184.75,ISSCC
1999,3.7,OS,SDCT,0.80 BiCMOS,A 400 MHz 12 b 18 mW IF digitizer with mixer inside a д? modulator loop,"One method of IF digitization consists of a down-conversion mixer followed by a lowpass д? modulator. However, as one moves to high IF, the down conversion mixer's distortion deteriorates rapidly and more power has to be dissipated to restore the mixer's distortion to an acceptable level. In order to achieve low-distortion while maintaining low power dissipation, a new digitizer that suppresses this mixer distortion by placing the mixer inside a modified д? feedback loop, and capable of operating at 400 MHz, is presented","Namdar, A.; Laung, B.H.", , ,1.5,,40000,66,,72,,,66,1.80E-02,2.00E+07,250,8.00E+04,2.25E+05,,137994.7,,129.5,1.72E+00,178.5,ISSCC
