YEAR,ID,TYPE,ARCHITECTURE,TECHNOLOGY,TITLE,ABSTRACT,AUTHORS,COMMENTS,Csamp [pF],AREA [mm^2],SNDR_lf [dB],fin_hf [Hz],SNDR_hf [dB],SNR [dB],DR [dB],-THD [dB],SFDR [dB],SNDR_plot [dB],P [W],fs [Hz],OSR,fsnyq [Hz],P/fsnyq [pJ],FOMW_lf [fJ/conv-step],FOMW_hf [fJ/conv-step],FOMS_lf [dB],FOMS_hf [dB],FOMW_hf/fsnyq,"FOMS,hf+10log(fsnyq)",source
2007,13.1,OS,"SDCT, Complex",0.09,A 56mW CT Quadrature Cascaded д? Modulator with 77dB DR in a Near Zero-IF 20MHz Band,A 90nm CMOS CT quadrature DeltaSigma modulator is designed for highly digitized wideband receivers. The ADC achieves 77dB DR and 20MHz BW around a 10.5MHz IF and is sampled at 340MHz. The cascaded modulator comprises programmable analog 2nd-order quadrature filters and a digital quadrature noise-cancellation filter. The 0.5mm2 chip draws 56mW from a 1.2V supply ,"Breems, L.J.; Rutten, R.; van Veldhoven, R.; van der Weide, G.; Termeer, H.",10.5MHz IF, ,0.5,,20000000,69,71,77,,,69,5.60E-02,3.40E+08,17,4.00E+07,1.40E+03,,607.8,,154.5,1.52E-05,230.55,ISSCC
2007,13.2,OS,SDSC,0.13,A 0.13?m CMOS EDGE/UMTS/WLAN Tri-Mode ?д ADC with -92dB THD,"A 2-2 cascaded multi-standard DeltaSigma modulator achieves a OR of 88/79/67dB in EDGE/UMTS/WLAN mode, respectively. With a high linearity of -92dB THD and 34dBm IIP3 for EDGE, this ADC is suitable for wireless applications. Implemented in 0.13 mum CMOS and occupying 0.4mm2, the modulator covers 0.1-to-10MHz signal bandwidth with scalable power consumption between 2.9 and 20.5mW from a 1.2V supply. ","Christen, T.; Burger, T.; Qiuting Huang",Data taken for WLAN mode, ,0.4,,10000000,63,,67,,,63,2.05E-02,2.40E+08,12,2.00E+07,1.03E+03,,888,,149.9,4.44E-05,222.89,ISSCC
2007,13.3,OS,SDCT,0.09,"A 1.2V, 121-Mode Continuous-Time SD Modulator for Wireless Receivers in 90nm CMOS","A reconfigurable CT 5th-order 1b DeltaSigma modulator is presented. The DR/BW is programmable from 85dB@100kHz to 52dB@10MHz in 121 steps. Implemented in a 90nm CMOS process, the 0.36mm 2 IC includes 2 DeltaSigma modulators, a bandgap reference, and a decimator. The power consumption of a single ADC in different modes ranges from 1.44 to 7mW at 1.2V supply","Ouzounov, S.; van Veldhoven, R.; Bastiaansen, C.; Vongehr, K.; van Wegberg, R.; Geelen, G.; Breems, L.; van Roermund, A.","Data taken for GSM mode, (best FOM=0.2pJ/conv-step)", ,0.36,,200000,,82,82,,,82,1.44E-03,2.60E+07,65,4.00E+05,3.60E+03,,349.9,,163.4,8.75E-04,219.45,ISSCC
2007,13.4,OS,"SDCT, SDSC",0.065,A 5th-order CT/DT Multi-Mode д? Modulator,"A 5th-order CT/DT multi-mode DeltaSigma ADC for the digitisation of baseband signals is presented. For accurate loop characteristics, the design uses DT switched-capacitor OTAs for the second- to fifth-stage integrators while the CT first-stage integrator provides anti-alias filtering. Implemented in 65nm CMOS, the design achieves 88/82/73dB DR for EDGE/CDMA/UMTS and draws < 1.5mA from a 2.5V supply.","Putter, B.",Data taken for CDMA mode (best FOM=0.5pJ/conv-step), ,0.125,,614000,,,82,,,82,3.10E-03,7.68E+07,63,1.23E+06,2.52E+03,,245.3,,165,2.00E-04,225.86,ISSCC
2007,13.5,NQ,SAR,0.09,"A 65fJ/Conversion-Step, 0?50MS/s 0?0.7mW 9bit Charge Sharing SAR ADC in 90nm Digital CMOS","A fully dynamic SAR ADC is proposed that uses passive charge-sharing and an asynchronous controller to achieve low power consumption. No active circuits are needed for high-speed operation and all static power is removed, offering power consumption proportional to sampling frequency from 50MS/s down to 0. The prototype implementation in 90nm digital CMOS achieves 7.8 ENOB, 49dB SNDR at 20MS/s consuming 290 muW. This results in a FOM of 65fJ/conversion-step.","Craninckx, J.; Van der Plas, G.","Data taken for 20MS/s, Nyquist input (ENOB=7.4)", ,0.08,,10000000,46.3,,,,,46.3,2.90E-04,2.00E+07,1,2.00E+07,1.45E+01,,85.9,,151.7,4.29E-06,224.69,ISSCC
2007,13.6,OS,"SAR, TI",0.13,A 14b 40MS/s Redundant SAR ADC with 480MHz Clock in 0.13pm CMOS,"A 2-channel time-interleaved 40MS/s SAR ADC with redundancy is presented. The 0.13mum 1.5V CMOS design runs at 480MHz iteration clock and features 89dB THD and 81dB SNDR. Including the PLL, the second-order anti-alias filter, and reference buffer, the chip consumes 66mW and occupies 0.55mm2. ","Hesener, M.; Eichler, T.; Hanneberg, A.; Herbison, D.; Kuttner, F.; Wenske, H.", , ,0.55,,960000,83,,,87,,83,6.60E-02,4.00E+07,8,5.00E+06,1.32E+04,,1143.3,,158.8,2.29E-04,225.77,ISSCC
2007,25.1,NQ,Pipe,0.09,A 0.8V 10b 80MS/s 6.5mW Pipelined ADC with Regulated Overdrive Voltage Biasing,"A low-voltage design is developed for amplifiers in the pipelined ADC, regulating overdrive voltage to be constant over PVT variations. A prototype 10b 80MS/S pipelined ADC is fabricated in a 90nm CMOS process. The ADC consumes 6.5mW from a 0.8V supply and occupies 1.18 times 0.54mm2","Yoshioka, M.; Kudo, M.; Mori, T.; Tsukamoto, S.",Data taken for VDD=0.8V, ,0.6372,,40000000,51.4,,,,,51.4,6.50E-03,8.00E+07,1,8.00E+07,8.13E+01,,267.7,,149.3,3.35E-06,228.32,ISSCC
2007,25.2,NQ,Two-Step,0.09,A 10b 160MS/s 84mW 1V Subranging ADC in 90nm CMOS,A 10b 160MS/S subranging ADC with THA is implemented in a 90nm digital CMOS process. Noise averaging and an auto-zeroed comparator are used in the fine converter to achieve low noise and offset at low power dissipation. The prototype converter achieves an ENOB of 9.1b for an 80MHz input and consumes 84mW from a 1V supply,"Huber, D.J.; Chandler, R.J.; Abidi, A.A.",Assumed ~9.1ENOB at Nyquist, ,0.42,,80000000,56.5,,,,,56.5,8.40E-02,1.60E+08,1,1.60E+08,5.25E+02,,956.7,,146.3,5.98E-06,228.37,ISSCC
2007,25.3,NQ,Pipe,0.09,A 4.7mW 0.32mm2 10b 30MS/s Pipelined ADC Without a Front-End S/H in 90nm CMOS,"A 4.7mW 10b 30MS/s pipelined ADC is implemented without a front-end S/H for low power consumption and small area. The prototype ADC, fabricated in a 90nm CMOS process, shows an SNDR of 58.4dB and an SFDR of 75.2dB with a 2MHz sinusoidal input sampled at 30MS/S. The 0.32 mm2 chip dissipates 4.7mW at a 1V supply and has a FOM of 0.23pJ/conversion-step. ",Young-Deuk Jeon; Seung-Chul Lee; Kwi-Dong Kim; Jong-Kee Kwon; Jongdae Kim, , ,0.32,,15000000,57,,,,,57,4.70E-03,3.00E+07,1,3.00E+07,1.57E+02,,270.8,,152,9.03E-06,226.81,ISSCC
2007,25.4,NQ,Pipe,0.09,A 10b 205MS/s 1.0mm2 90nm CMOS Pipeline ADC for Flat Panel Display Applications,A 10b 205MS/S 1mm2 ADC for flat-panel display applications is implemented in a 90nm CMOS process. The ADC with an LDO regulator achieves a 53dB PSRR for a 100MHz noise tone and a 55.2dB SNDR for a 30MHz 1Vpp single-ended input at 205MS/S. The core ADC power consumption is 40mW from a 1V non-regulated supply. ,Seung-Chul Lee; Young-Deuk Jeon; Kwi-Dong Kim; Jong-Kee Kwon; Jongdae Kim; Jeong-Woong Moon; Wooyol Lee,Power inlcudes SHA. SNDR and SFDR taken from charts (diff.), ,1,,103000000,55,,,,72,55,6.10E-02,2.05E+08,1,2.05E+08,2.98E+02,,647.6,,147.3,3.16E-06,230.37,ISSCC
2007,25.5,NQ,"Pipe, ZCBC",0.18,A Zero-Crossing Based 8b 200MS/s Pipelined ADC,A zero-crossing-based 8b 200MS/S pipelined ADC is implemented in a 0.18 mum CMOS process. It uses dynamic zero-crossing detectors and digital FFs that replace the functions of opamps and comparators. The ADC draws no static current. The power consumption is 8.5mW. The FOM is 0.51pJ/step,"Brooks, L.; Hae-Seung Lee",Data for 200MS/s, ,0.05,,100000000,40.3,,,,,40.3,8.50E-03,2.00E+08,1,2.00E+08,4.25E+01,,503.3,,141,2.52E-06,224,ISSCC
2007,25.6,NQ,Pipe,0.13,A 92.5mW 205MS/s 10b Pipeline IF ADC Implemented in 1.2V/3.3V 0.13&[mu]m CMOS,"A 10b 205MS/S IF sampling pipelined ADC is fabricated in 1.2/3.3V 0.13mum CMOS. Power consumption and die area are improved by using single-stage opamps throughout the pipeline chain; digital calibration compensates for the reduced stage gain. Foreground calibration is used to shorten the start-up time and background calibration is used afterwards. The ADC has ENOB of 9.0, ERBW of 330MHz, dissipates 92.5mW, and occupies 0.52mm2. ","Hernes, B.; Bjornsen, J.; Andersen, T.N.; Vinje, A.; Korsvoll, H.; Telsto, F.; Briskemyr, A.; Holdo, C.; Moldsvor, O.","SNDR taken from Fig.4, large ERBW", ,0.52,,103000000,54,,,,62,54,9.25E-02,2.05E+08,1,2.05E+08,4.51E+02,,1101.9,,144.4,5.37E-06,227.56,ISSCC
2007,25.7,NQ,"Pipe, TI",0.09,An 11-Bit 800-MS/s Time-Interleaved ADC with Digital Background Calibration,"An 11 b 800MS/S time-interleaved ADC is implemented in a 90nm CMOS process for a 10GBase-T application. A single open-loop T/H circuit using a cascode source follower achieves high resolution and conversion rate. The offset and gain mismatches are corrected by the digital background calibration. The measured DNL and INL are <0.5LSB and <1.6LSB, respectively. The measured SNDRs are 58 and 54dB for 15 and 400MHz inputs, respectively. The 1.4mm2 ADC consumes 350mW from a 1.3V supply (1.5V for T/H). ","Cheng-Chung Hsu; Fong-Ching Huang; Chih-Yung Shih; Chen-Chih Huang; Ying-Hsi Lin; Chao-Cheng Lee; Razavi, B.", , ,1.4,,400000000,54,,,,,54,3.50E-01,8.00E+08,1,8.00E+08,4.38E+02,,1068.4,,144.6,1.34E-06,233.61,ISSCC
2008,12.1,NQ,SAR,0.09,An 820uW 9b 40MS/s Noise-Tolerant Dynamic0SAR ADC in 90nm Digital CMOS,"Current trends in analog/mixed-signal design for battery-powered devices demand the adoption of cheap and power-efficient ADCs. SAR architectures have been recently demonstrated as able to achieve high power efficiency in the moderate-resolution/medium- bandwidth range in Craninckx, J. and Van der Plas, G., (2007). However, when the comparator determines in first instance the overall performance, as in most SAR ADCs, comparator thermal noise can limit the maximum achievable resolution. More than 1 and 2 ENOB reductions are observed in Craninckx, J. and Van der Plas, G., (2007) and Kuttner, F., (2002), respectively, because of thermal noise, and degradations could be even worse with scaled supply voltages and the extensive use of dynamic regenerative latches without pre-amplification. Unlike mismatch, random noise cannot be compensated by calibration and would finally demand a quadratic increase in power consumption unless alternative circuit techniques are devised.","V. Giannini, P. Nuzzo, V. Chironi, A. Baschirotto, G. Vander Plas, J. Craninckx", , ,0.0902,,20000000,53.3,,,,,53.3,8.20E-04,4.00E+07,1,4.00E+07,2.05E+01,,54.3,,157.2,1.36E-06,233.19,ISSCC
2008,12.2,NQ,"SAR, TI",0.065,Highly-Intereleaved 5b 250MS/s ADC with Redundant Channels in 65nm CMOS,"The 250 MS/S ADC has 36 time-interleaved 5b SAR ADC channels operating at 800 mV. Parallelism is used specifically to improve energy efficiency, and architectural solutions address the limitations of interleaving. Redundancy is used as an efficient technique to counteract the yield loss from local variation. A hierarchical top- plate sampling network reduces timing skew with extended sampling times and permits a partitioned clock network for minimum distribution requirements.","B. Ginsburg, A. Chandrakasan", , ,3,,125000000,28.4,,,,,28.4,1.20E-03,2.50E+08,1,2.50E+08,4.80E+00,,223.4,,138.6,8.94E-07,222.56,ISSCC
2008,12.3,NQ,Two-Step,0.09,A 150MS/s 133uW 7b ADC in 90nm Digital CMOS Using a Comparator-Based Asynchronous Binary-Search Sub-ADC,"In this paper, a 2-step 7b ADC consists of a TVH, followed by a 1b comparison and D/A conversion, and a 6b comparator-based asynchronous binary-search (CABS) conversion. The 7b ADC operates as follows: the passive T/H samples the input signal on a capacitance, the 1b comparator determines the sign of the input and steers a capacitive DAC. The DAC subtracts 1/4 of the full-scale range in charge from one of the input nodes, changing simultaneously differential signal and common-mode level to be in range of the 6b CABS converter. The clock buffer generates the 1b coarse A/D clock signal and starts the 6b fine conversion after the 1b D/A conversion has finished.","G. Van der Plas, B. Verbruggen", ,0.25,0.0625,,75000000,40,,,,53.9,40,1.34E-04,1.50E+08,1,1.50E+08,8.90E-01,,10.9,,157.5,7.26E-08,239.26,ISSCC
2008,12.4,NQ,SAR,0.065,A 1.9uW 4.4fJ/conversion-step 10b 1MS/s Charge-Redistribution ADC,"An ADC for energy scavenging is proposed using a charge-redistribution DAC, a dynamic 2-stage comparator, and a delay-line-based controller realized in CMOS. The charge-redistribution DAC can be used in a simple way to make a SAR ADC. The 10b differential ADC uses bootstrapped NMOS devices to sample the differential input voltage onto two identical charge-redistribution DACs. The test chip is fabricated in a 65nm CMOS process. In this ADC, the MSB is set in between the sampling phase and the first comparison, saving energy and time.","M. van Elzakker, E. van Tuijl, P. Geraedts, D. Schinkel, E. Klumperink, B. Nauta", ,0.5,0.0275,,500000,54.4,55.6,,61.1,,54.4,1.90E-06,1.00E+06,1,1.00E+06,1.90E+00,,4.4,,168.6,4.43E-06,228.6,ISSCC
2008,12.5,NQ,SAR,0.18,A 9.4-ENOB 1V 3.8uW 100kS/s SAR ADC with Time-Domain Comparator,"The ADC-SAR is fabricated in a 0.18mum 2P5M CMOS process. This SAR-ADC converter achieves 56fJ/conversion-step FOM with 58dB SNDR. It uses a comparator, named time-domain comparator, that instead of operating in the voltage domain, transforms the input and the reference voltages into pulses and compares their duration.","A Agnes, E. Bonizzoni, P. Malcovati, F. Maloberti", ,15,0.24,,50000,58,,,,71.8,58,3.60E-06,1.00E+05,1,1.00E+05,3.60E+01,,55.5,,159.4,5.55E-04,209.43,ISSCC
2008,12.6,NQ,Pipe,0.18,A 14b 100MS/s Pipelined ADC with a Merged Active S/H and first MDAC,"The prototype ADC is implemented in 0.18mum dual gate-oxide (DGO) CMOS technology and achieves 72.4dB SNR and 88.5dB SFDR at 100MS/s with a 46MHz input while consuming 230mW from a 3V supply. Recently, power saving has been achieved by removing the explicit active S/H. Instead of removing the S/H, this work solves these drawbacks by merging the active S/H amplifier with the first MDAC (SMDAC). Thus, the ADC achieves low-power operation without sacrificing speed or accuracy.","B. Lee, B. Min, G. Manganaro, J. W. Valvano", , ,7.28,,50000000,,72.2,,,,72.2,2.30E-01,1.00E+08,1,1.00E+08,2.30E+03,,690.8,,155.6,6.91E-06,235.57,ISSCC
2008,12.7,NQ,Pipe,0.065,A 1.2V 4.5mW 10b 100MS/s Pipeline ADC in 65nm CMOS,"A low-power 1.2 V pipelined ADC is implemented in a 65 nm CMOS process to achieve 10b resolution at 100 MS/s based on the use of a dedicated thin-oxide high-performance analog (HPA) MOS transistor. The pipeline ADC is composed of eight 1.5b pipelined stages followed by a 2b flash converter as the last stage. In order to optimize the power consumption, the capacitances and the bias current of each stage have been scaled down along the pipeline chain. Measurement results of this ADC revealed a SNDR of 59 dB with a power dissipation of 4.5 mW. The core occupies 0.07 mm2, and 0.1 mm2 with the reference. ","M. Boulemnakher, E. Andre, J. Roux, F. Paillardet", , ,0.07,,50000000,59,,,74,,59,4.50E-03,1.00E+08,1,1.00E+08,4.50E+01,,61.8,,159.5,6.18E-07,239.46,ISSCC
2008,12.8,NQ,Folding,0.09,A 2.2mW 5b 1.75GS/s Folding Flash ADC in 90nm Digital CMOS,"High-speed low-resolution ADCs are an essential part of receivers for wireless standards such as UWB. These converters have to combine the stringent speed specifications with the demand for low power consumption. Flash architectures are often chosen because they offer the largest speed. However, in this architecture, area and power depend exponentially on the resolution since the comparators are often the largest contributor to the overall power consumption. Folding is a well-known technique used to reduce the number of comparators in an ADC while maintaining high speed. It was previously implemented by generating a number of zero crossings with folding amplifiers, often in combination with interpolation or averaging. In this design, a folding factor of 2 is realized as in but with only dynamic power consumption and without using amplifiers. This reduces the number of comparators from 31 to 16 for a 5b resolution.","B. Verbruggen, J. Cranickx, M. Kuijk, P. Wambacq, G. Van der Plas", ,0.2,0.0165,29.9,875000000,27.6,,,,32,27.6,2.20E-03,1.75E+09,1,1.75E+09,1.26E+00,49.2,64.5,145.9,143.5,3.69E-08,235.98,ISSCC
2008,27.2,OS,SDSC,0.18,A 0.7V 36uW 85dB-DR Audio delta-sigma Modulator Using a Class-C Inverter,"This paper presents an improved low-power DeltaSigma modulator, exploiting the class-C inverter and the feedforward topology. The measurement results show 14b dynamic range for a 20kHz bandwidth with 36muW power consumption from a 0.7V supply.","Y. Chae, I. Lee, G. Han", , ,0.715,,20000,81,84,85,,93,81,3.60E-05,4.00E+06,100,4.00E+04,9.00E+02,,98.1,,168.4,2.45E-03,214.47,ISSCC
2008,27.3,OS,SDSC,0.065,An Inverter-Based Hybrid delta sigma Modulator,The SigmaDelta modulator presented in this paper exploits the advantages of new CMOS technologies by digitization on both architectural and circuit level. The target DR of the modulator is 77dB in 200kHz.,"R. Veldhoven, R. Rutten, L. Breems", , ,0.03,,200000,,77,,79,,77,9.50E-04,1.50E+08,375,4.00E+05,2.38E+03,,410.5,,160.2,1.03E-03,216.25,ISSCC
2008,27.4,OS,"SDSC, TI",0.18,"A Noise-Coupled Time-Interleaved delta sigma AD with 4.2MHz Bw, -98dB THD, and 79dB SNDR","In this paper, two prototype versions of a SC time-interleaved DeltaSigma ADC are described. Both use quantization- noise coupling for enhanced noise shaping. They achieve high linearity, and FOMs of 0.33 and 0.48pJ/conversion-step, in signal BWs of 2.5 and 4.2MHz, respectively.","K. Lee, J. Chae, M. Aniya, K. Hamashita, K. Takasuka, S. Takeuchi, G. Temes",Data for 2.5MHz BW, ,3.67,,2500000,81,81,83,104,,81,1.50E-02,6.00E+07,12,5.00E+06,3.00E+03,,327.1,,163.2,6.54E-05,230.21,ISSCC
2008,27.5,OS,SDSC,0.09,A 28mW Spectrum-Sensing Reconfigurable 20MHz 72dB-SNR 70dB-SNDR DT delta sigma ADC for 802.11n/WiMax Receivers,"A reconfigurable power-adaptive DT DeltaSigma ADC for intelligent 802.11n/WiMAX receivers (20 to 2.5MHz per I/Q) is presented. The intent is to replace complex analog baseband circuits with a combination of tunable one-pole filter, anti-alias filter and coarse VGA in Paramesh, J. et al (2006). Blocker filtering, fine variable-gain amplification and variable-BW channel selection are moved to the digital baseband. The SNR is optimized as a function of signal and out-of-band blocker power in Behbahani, F. et al, (2001) by reconfiguring the modulator order into one of 4 modes at constant fs, thereby keeping anti-aliasing unchanged. A 5b flash ADC integrated in the converter is the front end of a simple spectrum analyzer (SSA). Spectrum sensing and reconfigurability are accomplished without compromising ADC performance.","P. Malla, H. Lakdawala, K. Kornegay, K. Soumyanath","Reconfigurable, MASH21 used", ,1,,20000000,64,67,72,,79,64,2.79E-02,4.20E+08,11,4.00E+07,6.98E+02,,538.6,,152.6,1.35E-05,228.57,ISSCC
2008,27.6,OS,SDCT,0.18,A 100mW 10MHz-BW CT delta sigma Modulator with 87dB DR and -91dBc IMD,This paper describes a continuous time DeltaSigma modulator with 10MHz of bandwidth that achieves a DR of 87dB and an IMD of -91dBc while consuming 100mW.,"W. Yang, W. Schofield, H. Shibata, S. Korrapati, A. Shaikh, N. Abaskharoun, D. Ribner", , ,0.7,,10000000,82,,87,,,82,1.00E-01,6.40E+08,32,2.00E+07,5.00E+03,,485.9,,162,2.43E-05,235.01,ISSCC
2008,27.7,OS,SDCT,0.065,A 65nm CMOS CT delta sigma Modulator with 81dB DR and 8MHz BW Auto-Tuned by Pulse Injection,"In the digital wireless SoC applications, CT DeltaSigma ADCs have been widely used for I/Q quantization due to the built-in anti-aliasing function and insensitivity to the input sampling error. They also offer higher-frequency performance than SC modulators as no critical opamp settling is required. CT modulators with low OSR have achieved a DR greater than 75 dB in a 20 MHz band. However, they all suffer from inaccurate active filtering as filter time constants are set by RC and C/Gm values that vary by as much as plusmn20 to 30%. By lowering OSR, the signal band can be widened, but the in-band zero of the NTF should be optimally placed to maximize the DR. Inaccurate NTF zero either degrades the DR or makes the modulator unstable. This work presents an exact time-constant auto-tuning method using an LMS algorithm. With a binary pulse dither injected into the loop at the input of the quantizer, the filter time constant can be calibrated continuously with crystal accuracy until the correlated residual pulse dither disappears in the digital output.","Y-S. Shu, B-S. Song, K. Bacrania", , ,0.5,,8000000,,,81,,,81,5.00E-02,2.56E+08,16,1.60E+07,3.13E+03,,340.8,,163,2.13E-05,235.08,ISSCC
2008,27.8,OS,SDCT,0.045,A CT delta sigma ADC for Voice Coding with 82dB DR in 45nm CMOS,"This paper wants to clarify the important design parameters of the 45 nm process like matching, flicker noise, and offset from an analog designers' point of view. This paper describes a continuous time DeltaSigma ADC for voice coding applications.","L. Doerrer, F. Kuttner, A. Santner, C. Kropf, T. Puaschitz, T. Hartig", , ,0.0888,,20000,76.5,78.7,92,80,,76.5,1.20E-03,1.20E+07,300,4.00E+04,3.00E+04,,5492.2,,148.7,1.37E-01,194.74,ISSCC
2008,30.1,NQ,Pipe,0.18,An Over-60dB True Rail-to-Rail Performance Using Correlated Level Shifting and an Opamp with 30dB Loop Gain,"This work introduces correlated level shifting (CLS) that simultaneously decreases the error due to finite opamp gain and allows true rail-to-rail operation. An extra phase is needed, but, surprisingly, there is no speed penalty when compared to a high-gain opamp solution because CLS does not require full settling during the next-to-last phase. In fact, the increased signal swing means that the same SNR can be achieved using smaller sampling capacitors. Thus, it could be argued that CLS can provide accurate results at a higher speed than using a traditional 2-phase operation with a high-gain opamp. For example, with CLS, the performance is maintained over the whole 0.9V supply, whereas a standard configuration has only a 0.6V swing. Thus, the standard configuration requires 2.25x larger sampling capacitors to achieve the same signal to kT/C noise ratio.","B. Gregoire, U-K. Moon", , ,2.3,,10000000,64.7,66.4,,70.3,73.6,64.7,8.70E-03,2.00E+07,1,2.00E+07,4.35E+02,,309.9,,155.3,1.55E-05,228.32,ISSCC
2008,30.2,NQ,"SAR, TI",0.13,A 32mW 1.25GS/s 6b 2b/step SAR ADC in 0.13um CMOS,"ADCs with 6b resolution and gigahertz sampling frequency are widely used in serial links, magnetic recording systems and UWB receivers. Flash ADCs have been dominantly used for these applications. This paper presents an ADC that takes advantage of the high-speed digital logic and highly matched small capacitors in deep-submicron digital CMOS processes to achieve similar performance, but with lower power consumption than flash ADCs. Unlike many previously published low-power high-speed ADCs based on time-interleaved SAR, this ADC has only 2 clock-cycle latency (1.6ns at 1.25GS/s) and achieves 6b performance without any digital post-processing or off-line calibration, making it a plug- in replacement for conventional flash ADCs in many applications.","Z. Cao, S. Yan, Y. Li",SNDR stays >32 dB up to fin=450MHz, ,0.09,,450000000,32,,,,48,32,3.20E-02,1.25E+09,1,1.25E+09,2.56E+01,,787.2,,134.9,6.30E-07,225.88,ISSCC
2008,30.3,NQ,"SAR, TI",0.09,A 24GS/s 6b ADC in 90nm CMOS,"This paper presents a 24 GS/s 6 b ADC in 90 nm CMOS with the highest ENOB up to 12 GHz input frequency and lowest power consumption of 1.2 W compared to ADCs with similar performance. It uses an interleaved architecture of SAR type self-calibrating converters operating from 1 V supply combined with an array of 2.5 V T/Hs with delay, gain and offset-calibration capability.","P. Schvan, J. Bach, C. Falt, P. Flemke, R. Gibbins, Y. Greshishchev, N. Ben-Hamida, D. Pollex, J. Sitch, S-C. Wang, J. Wolczanski","Data for up to 8GHz, SNDR above 22.8 dB up to fin 12GHz", ,16,34.9,12000000000,22.8,,,,,22.8,1.20E+00,2.40E+10,1,2.40E+10,5.00E+01,1104.9,4419.4,134.9,122.8,1.84E-07,226.63,ISSCC
2008,30.4,NQ,Pipe,0.065,A 1V 11b 200MS/s Pipelined ADC with Digital Background Calibration in 65nm CMOS,This paper demonstrates a IV 200MS/s pipelined ADC with digital background calibration in 65nm digital CMOS process. ,"K-W. Hsueh, Y-K. Chou, Y-H. Tu, Y-F. Chen, Y-L. Yang, H-S. Li",SNDR/SFDR is 59.9dB/64.9dB at fin=60MHz, ,1.1,,60000000,59.9,,,,64.9,59.9,1.80E-01,2.00E+08,1,2.00E+08,9.00E+02,,1114.2,,147.3,5.57E-06,230.36,ISSCC
2008,30.7,NQ,Two-Step,0.09,A Split-Load Interpolation-Amplifier-Array 300MS/s 8b Subranging Adc in 90nm CMOS,"The ADC is fabricated in 90 nm digital CMOS process. The chip consumes 34 mW at 300MS/s (fin=fs/2) from 1.2 V analog/digital and 2.5 V T/H-switches supply. At 100 MS/s (fin= fs/2), it consumes 6.7 mW from 0.75 V analog/digital and 1.5 V T/H-switches supplies. FOMs are 780 fJ/conversion-step at 300 MS/s (fin=fs/2), 680fJ/conversion-step at 300MS/s (fin=2MHz), 350 fJ/conversion- step at 100 MS/s (fin=fs/2) and 290 fJ/conversion-step at 100 MS/s (fin=2MHz).The active area is 0.29 mm2. ","Y. Shimizu, S. Murayama, K. Kudoh, H. Yatsuda", , ,0.29,,150000000,38.4,,,,,38.4,3.40E-02,3.00E+08,1,3.00E+08,1.13E+02,,1667.9,,134.8,5.56E-06,219.62,ISSCC
